KO ID,Domain,Title,Controlled Rule,Category,Status,Production Eligible,Regulatory Reference,Dependencies,File,Word Count,Rule Hash
SDI-004,Screening Decision Intelligence,Active MAH Verification,"Screening shall verify whether the identified Brand Name, Generic Name, API or INN belongs to an active Marketing Authorisation Holder (MAH) product according to the Client Product Master. Only products with an active MAH in the determined COI shall proceed as potential client-valid literature cases.",Business Rule,Approved,True,GVP Module VI,LF-023; LF-024; OI-001; VAL-001,04_Screening_Decision_Intelligence/SDI-004.md,1498,3460f4018703ee91000a02bfd48f6c7efebac7f94c59b262cb65ab313966b35c
SDI-005,Screening Decision Intelligence,Product Lifecycle Verification,Screening shall determine whether the identified company product is marketed (Post-Marketing Surveillance) or investigational (Clinical Trial) using the Client Product Master. Product lifecycle classification shall determine the applicable literature processing pathway.,Decision Rule,Approved,True,GVP Module VI,LF-023; LF-024; OI-001; VAL-001,04_Screening_Decision_Intelligence/SDI-005.md,1452,84ce1dfb6ff5a7cadb0750d0ae685675300d7a488d298fea8cc726abc484872f
SDI-006,Screening Decision Intelligence,Publication Type Independence,"Publication type alone shall never determine inclusion or exclusion. Every publication type shall be evaluated using its applicable inclusion criteria, exclusion criteria, validity criteria and approved business rules before a screening recommendation is generated.",Screening Principle,Approved,True,ClinixAI,LF-023; LF-024; OI-001; VAL-001,04_Screening_Decision_Intelligence/SDI-006.md,1420,4d86978dc010c94e79861212c26af4104189b372ca1fbb1429c2e05ffca3e04c
SDI-007,Screening Decision Intelligence,Deterministic Screening,"Wherever structured data, validated dictionaries or approved business rules can determine a screening decision, they shall take precedence over Large Language Model reasoning. AI reasoning shall supplement, not replace, deterministic regulatory logic.",AI Governance,Approved,True,ClinixAI,LF-023; LF-024; OI-001; VAL-001,04_Screening_Decision_Intelligence/SDI-007.md,1446,a172948aa3a3e617c89edece79fa84e6232618f633637190a23a4daf1e3eea37
SDI-008,Screening Decision Intelligence,Evidence-Based Screening,"Every screening recommendation shall be supported by explicit evidence identified within the literature article or an approved knowledge source. ClinixAI shall not infer, assume or fabricate missing regulatory evidence. When evidence is insufficient, the corresponding output shall be reported as Unknown or escalated for manual review according to approved business rules.",AI Boundary,Approved,True,"GVP Module VI, ClinixAI",LF-023; LF-024; OI-001; VAL-001,04_Screening_Decision_Intelligence/SDI-008.md,1468,ae320ff8ac568432080a2b3239dd0887e24e37635c2ae069c0dda6a5c93bd39a
SDI-009,Screening Decision Intelligence,Reviewer Override,"Authorized reviewers may override AI-generated screening recommendations. Every override shall require documented justification, reviewer identity, timestamp and complete audit trail. The original AI recommendation shall remain permanently preserved for inspection.",Workflow Rule,Approved,True,"GVP Module VI, ALCOA+",LF-023; LF-024; OI-001; VAL-001,04_Screening_Decision_Intelligence/SDI-009.md,1409,006f15f3fedb781af27bad7c9c81bb4e0d0e0f465281cc979f8ead57e402b4eb
SDI-010,Screening Decision Intelligence,Explainable Screening,"Before reviewer confirmation, ClinixAI shall present the supporting evidence, applied business rules, identified products, publication classification, validity assessment, MAH verification and rationale supporting every screening recommendation. Every regulatory decision shall be explainable using approved knowledge sources. If explainability cannot be established, the recommendation shall not be considered final.",AI Governance,Approved,True,"GVP Module VI, ClinixAI",LF-023; LF-024; OI-001; VAL-001,04_Screening_Decision_Intelligence/SDI-010.md,1430,7a6aa33f466d12737fd544c1b355796fb5b0e8fd0978f9ee7db420d709fcf739
OI-001,Output Intelligence,Country of Incidence (COI) Determination,"For literature cases, ClinixAI shall determine the Country of Incidence (COI) using the approved COI hierarchy. COI shall represent the country where the adverse event or special situation occurred and shall be used for all downstream regulatory assessments.",Core Output Principle,Approved,True,ClinixAI Literature Standard,LF-022; LF-029,05_Output_Intelligence/OI-001.md,1510,4381a19f4e997f96af7fb629fca4e8be94657dda1d387ff4cfaba51230332448
OI-002,Output Intelligence,COI Determination Hierarchy,"COI shall be determined in the following order: (1) Patient country explicitly stated in the article; (2) If the patient experienced the event while travelling, the country where the event occurred; (3) Primary reporter's working country; (4) If unavailable, determine the reporter country from affiliation, organization, university or address; (5) Secondary reporter using the same hierarchy; (6) Article publication country. Each determination step shall be recorded in the audit trail.",Decision Rule,Approved,True,ClinixAI,LF-022; LF-029,05_Output_Intelligence/OI-002.md,1529,fa178ceaf2cfd0293cda76a230b0f0020decf0d328d5d20197e9c1962117a5aa
OI-003,Output Intelligence,Reporter Country Resolution,"When the reporter's country is not explicitly stated, ClinixAI shall derive the country from institutional affiliation, hospital, university, organization, postal address or geographic information. The resolved country and supporting evidence shall be presented to the reviewer.",AI Rule,Approved,True,ClinixAI,LF-022; LF-029,05_Output_Intelligence/OI-003.md,1487,cdde5c729c9a6987851a68c352b78c4a78277e855c8f60cdeb72eb5febf4e69d
OI-004,Output Intelligence,Safety Information Definition,"For literature screening, Safety Information shall be defined as: Identifiable Patient + Adverse Event, Identifiable Patient + Special Situation, or Identifiable Patient + Adverse Event + Special Situation. Articles not meeting this definition shall not be classified as containing safety information.",Core Regulatory Principle,Approved,True,"GVP Module VI, ClinixAI",LF-022; LF-029,05_Output_Intelligence/OI-004.md,1390,909483396c3c9bace5b1387041019241fb2a96181edcd1075a2f2a058018dfa1
OI-005,Output Intelligence,Full-Text Acquisition,"Whenever a full-text article is freely available, ClinixAI shall retrieve and preserve the complete publication as part of the Evidence Package. Full-text shall always take precedence over abstract-only information when both are available.",Workflow Rule,Approved,True,GVP Module VI,LF-022; LF-029,05_Output_Intelligence/OI-005.md,1436,ea820ad23ac77b9c4f473d2075a7f3ad6f5e6ff40cdbb51f6c523d02dbdb5ccf
OI-006,Output Intelligence,Full-Text Request Workflow,"If the full text is unavailable but the abstract indicates that full-text review is required to determine the existence of an adverse event, special situation or case validity, ClinixAI shall generate a Full-Text Request. The request shall be routed to the MAH or client for procurement. The article shall remain pending until the full text is available or an authorized decision is recorded.",Workflow Rule,Approved,True,ClinixAI,LF-022; LF-029,05_Output_Intelligence/OI-006.md,1466,faef2c39e6e601e7d646ad5f4660b1e2012685a3419790dedb2b02f8e005abb2
OI-007,Output Intelligence,Original Language Preservation,The original publication language shall remain the regulatory source document. AI-generated translations shall support reviewer understanding but shall never replace or overwrite the original publication. Both the original language and translated version shall remain linked within the Evidence Package.,AI Boundary,Approved,True,GVP Module VI,LF-022; LF-029,05_Output_Intelligence/OI-007.md,1439,c661514e4d69986bcbdbe61dcaffe63c38c59405219a2e7ebe6897ab39c77e3e
OI-008,Output Intelligence,Confidence Score & Unknown Handling,"Every extracted output shall include a confidence score generated by ClinixAI. When required evidence cannot be confidently identified, the corresponding field shall be populated as Unknown rather than inferred. Multiple Unknown outputs shall increase the recommendation for manual verification.",AI Governance,Approved,True,ClinixAI,LF-022; LF-029,05_Output_Intelligence/OI-008.md,1387,97445e2985562cecd9a23a44f727ad116790605a3de448d995a9da4ebe86d90e
OI-009,Output Intelligence,Manual Review Recommendation,"Every literature article shall undergo human review. ClinixAI shall recommend increased manual attention when confidence scores are low, multiple critical fields are Unknown, conflicting evidence exists, or the scenario falls outside the scope of the approved knowledge engine. AI recommendations shall never replace reviewer responsibility.",Workflow Rule,Approved,True,GVP Module VI,LF-022; LF-029,05_Output_Intelligence/OI-009.md,1395,6cda63fac76a6de80ed8529aa57273714dade538e0d4da970517a298e7e1a328
OI-010,Output Intelligence,Output Traceability & Explainability,"Every output generated by ClinixAI—including COI, product identification, validity, publication classification, safety information, inclusion/exclusion classification and screening recommendation—shall be traceable to explicit evidence within the article or an approved knowledge source. Every regulatory decision shall be explainable using approved knowledge. If supporting evidence cannot be demonstrated, the decision shall not be finalized.",AI Governance,Approved,True,"GVP Module VI, ClinixAI",LF-022; LF-029,05_Output_Intelligence/OI-010.md,1410,825b20a469b38c6d82e9717dde733a7a9e0c612e3bf299adf1c018df203dc011
VAL-001,Validity Engine,Literature Valid Case Definition,"A literature article shall only be considered a valid client literature case when all minimum validity elements are present: (1) Identifiable Patient, (2) Identifiable Reporter, (3) Company Suspect Product, (4) Adverse Event and/or applicable Special Situation, and (5) The identified company suspect product has an Active MAH in the determined Country of Incidence (COI).",Core Validity Principle,Approved,True,"GVP Module VI, ClinixAI",LF-023; OI-001; OI-004,06_Validity_Engine/VAL-001.md,1489,3c8ecf2990815f3d3a84c9d561579ce7987832f0f249aa3a3a9518d12e861819
VAL-002,Validity Engine,Identifiable Patient,"An identifiable patient may be established using one or more patient identifiers including: Name, Initials, Age, Age Group (Neonate, Infant, Child, Adolescent, Adult, Elderly, etc.), Gender/Sex, Pronouns (he, she, him, her), Race, Ethnicity, Pregnancy Details, Date of Birth (full or partial), Country, Height, Weight or other unique patient descriptors. Personally identifiable information (PII) shall be masked in outputs where required.",Validity Rule,Approved,True,GVP Module VI,LF-023; OI-001; OI-004,06_Validity_Engine/VAL-002.md,1467,6019a2c8597b96aa78199b595ec33fae02df0e5ebf3031535cb5ddd3ee8dd382
VAL-003,Validity Engine,Identifiable Reporter,"An identifiable reporter may be established using one or more reporter identifiers including: Name, Salutation, Organization, Hospital, University, Department, Postal Address, Postal Code, City, State, Country, Email or other professional identifiers. Reporter information shall support case validity and COI determination while complying with applicable privacy requirements.",Validity Rule,Approved,True,GVP Module VI,LF-023; OI-001; OI-004,06_Validity_Engine/VAL-003.md,1455,744a0ee5a8a8769ea88b64bb79ec94b5e36f671dd718076f104e3e9c856c766e
VAL-004,Validity Engine,Company Suspect Product Identification,"A company suspect product may be identified through Brand Name, Generic Name, API, INN, Salt Form, approved Synonym or approved Abbreviation recognized within the Client Product Master. Product normalization shall occur before validity assessment.",Business Rule,Approved,True,"GVP Module VI, ClinixAI",LF-023; OI-001; OI-004,06_Validity_Engine/VAL-004.md,1445,86c00cf02c82e4f20158645c2012bd0a62508f0b6294ee5f765c4c4da79af0fb
VAL-005,Validity Engine,Adverse Event & Special Situation Recognition,ClinixAI shall recognize both clinical adverse events and approved pharmacovigilance special situations. Exposure during pregnancy shall be recognized as a reportable special situation. Special situations shall contribute to literature safety information according to approved business rules.,Medical Knowledge Rule,Approved,True,GVP Module VI,LF-023; OI-001; OI-004,06_Validity_Engine/VAL-005.md,1450,be37cf2f7854af14d67f29b61900925a3e7e3d84e4b0aaacb86ba677a15255e9
VAL-006,Validity Engine,Active MAH Verification,"A literature article shall only be considered a valid literature case for the client when the identified company suspect product has an Active Marketing Authorisation Holder (MAH) in the determined Country of Incidence (COI). If no active MAH exists in the COI, the article shall not be classified as a valid client literature case.",Business Rule,Approved,True,GVP Module VI,LF-023; OI-001; OI-004,06_Validity_Engine/VAL-006.md,1493,2b9d90736a20ce8354d6f8fadc25a7330aadc333e00049ac2054152cdc384d37
VAL-007,Validity Engine,Personally Identifiable Information (PII) Recognition,"ClinixAI shall recognize direct and indirect PII. This includes names, initials, addresses, contact details and relationship descriptors (e.g., husband, wife, son, daughter, daughter-in-law, father, mother, grandparents, neighbour, friend, colleague and similar identifiers). PII shall be handled according to approved privacy and masking requirements.",Privacy Rule,Approved,True,"GVP Module VI, Data Privacy Principles",LF-023; OI-001; OI-004,06_Validity_Engine/VAL-007.md,1425,1f3cd5d6faab999c7337dd988a3920be11b43d1b8a94e79a06c974ec3bc2131d
VAL-008,Validity Engine,Evidence-Based Validity Assessment,"Every validity determination shall be supported by explicit evidence extracted from the literature article. ClinixAI shall not infer missing validity elements. If evidence is insufficient, the corresponding validity field shall be reported as Unknown and the article shall proceed according to approved workflow rules.",AI Governance,Approved,True,"GVP Module VI, ClinixAI",LF-023; OI-001; OI-004,06_Validity_Engine/VAL-008.md,1508,381c8c2f504aa3c1ca34f9ea307b96974eda83691483ecf4134f13c547e4db00
VAL-009,Validity Engine,Medical Knowledge Recognition,ClinixAI shall apply approved medical knowledge sources when evaluating literature. Medically Important Events (IME) shall be recognized using the latest approved IME reference. CTCAE shall support identification of medically significant clinical findings where applicable. Medical knowledge shall assist recognition but shall not independently determine seriousness unless supported by approved regulatory criteria or explicit article evidence.,Medical Knowledge Rule,Approved,True,"IME List, CTCAE, GVP Module VI",LF-023; OI-001; OI-004,06_Validity_Engine/VAL-009.md,1429,caab5f2b4b57c47678797db3061e0e910262f8cfdeb3e0f661092301fda9b0d7
VAL-010,Validity Engine,Explainable Regulatory Decision,"Every regulatory validity decision shall be traceable to explicit evidence contained within the literature article and supported by an approved knowledge source. If the decision cannot be explained using approved evidence and knowledge, the validity determination shall not be finalized.",AI Governance,Approved,True,"GVP Module VI, ClinixAI",LF-023; OI-001; OI-004,06_Validity_Engine/VAL-010.md,1412,111a06223358e83d6f69f4e93ebace2e23629f402aca98de0ef03470bba0af19
CDS-001,Constitution and Governance,Knowledge Supremacy Principle,"ClinixAI AI shall operate using governed and currently effective knowledge. Approved client requirements, regulatory guidance, ClinixAI Knowledge Objects, deterministic business rules and validated master data shall take precedence over ungoverned model memory or probabilistic completion.",AI Constitution / Governance,Draft – Requires Approval,False,"ClinixAI Governance Standard; alignment to applicable GxP, data integrity, privacy and AI governance requirements",,00_Governance/CDS-001.md,1473,278938f2bca323e2897c67c0593d351ce15e53d6d9c36ac5ce972f4adb7f4c05
CDS-002,Constitution and Governance,Explainability by Design,"Every AI-assisted pharmacovigilance output shall be explainable through supporting source evidence, applied Knowledge Objects, deterministic rules, versioned configuration and an auditable reasoning summary. An output that cannot be explained shall not be finalized.",AI Constitution / Governance,Draft – Requires Approval,False,"ClinixAI Governance Standard; alignment to applicable GxP, data integrity, privacy and AI governance requirements",CDS-001,00_Governance/CDS-002.md,1466,1944754ee89fe552307a42184e83408d60bf877cb66bcf5b0af504c63c8bbdc0
CDS-003,Constitution and Governance,Hallucination Prohibition,"ClinixAI shall not fabricate patients, reporters, products, events, countries, dates, seriousness criteria, case-validity elements, citations or regulatory conclusions. Missing information shall remain Unknown or be escalated for review.",AI Constitution / Governance,Draft – Requires Approval,False,"ClinixAI Governance Standard; alignment to applicable GxP, data integrity, privacy and AI governance requirements",CDS-001,00_Governance/CDS-003.md,1458,5b984b861e86adc487820187d318fa77d84b34ba6cc8ae57c27ebbfd6ce2f810
CDS-004,Constitution and Governance,Unknown Principle,"When the available evidence is insufficient, conflicting or outside the approved knowledge scope, ClinixAI shall return Unknown, Not Assessable or Manual Review Required according to the applicable data contract rather than infer a regulatory fact.",AI Constitution / Governance,Draft – Requires Approval,False,"ClinixAI Governance Standard; alignment to applicable GxP, data integrity, privacy and AI governance requirements",CDS-001,00_Governance/CDS-004.md,1459,e6f4610ab9a0d489293945a18fe9f4ebeff67623e32b4c600d027b6505a95e76
CDS-005,Constitution and Governance,Evidence Before Conclusion,"No regulatory or medical conclusion shall be generated without traceable evidence from the source article, approved master data, an effective Knowledge Object or an approved deterministic rule.",AI Constitution / Governance,Draft – Requires Approval,False,"ClinixAI Governance Standard; alignment to applicable GxP, data integrity, privacy and AI governance requirements",CDS-001,00_Governance/CDS-005.md,1495,368c9fb85a0bb6058f1c876f37931a5d31c5e25b34c421e12acee6790fb68feb
CDS-006,Constitution and Governance,Human Authority Principle,"ClinixAI supports authorized pharmacovigilance personnel and does not replace their accountability. Final review, override, approval and submission responsibility remains with appropriately authorized human users.",AI Constitution / Governance,Draft – Requires Approval,False,"ClinixAI Governance Standard; alignment to applicable GxP, data integrity, privacy and AI governance requirements",CDS-001,00_Governance/CDS-006.md,1458,6984098122dfa559473d08624b86a2c2d548079506cb949bff782931a06f6963
CDS-007,Constitution and Governance,Deterministic Before Probabilistic,"Validated structured data, product master records, configured decision tables and approved business rules shall execute before LLM reasoning. The LLM may interpret unstructured evidence but shall not override deterministic outcomes without an authorized, documented workflow.",AI Constitution / Governance,Draft – Requires Approval,False,"ClinixAI Governance Standard; alignment to applicable GxP, data integrity, privacy and AI governance requirements",CDS-001,00_Governance/CDS-007.md,1506,ba1a4407876a2eb59b29f50fb381bd2896f665ae429a7c8f3c5b60f0a4f273c6
CDS-008,Constitution and Governance,Regulatory Neutrality,"ClinixAI outputs shall be driven by evidence and approved requirements, not by commercial preference, productivity pressure, desired inclusion rates, desired exclusion rates or user attempts to influence a safety conclusion.",AI Constitution / Governance,Draft – Requires Approval,False,"ClinixAI Governance Standard; alignment to applicable GxP, data integrity, privacy and AI governance requirements",CDS-001,00_Governance/CDS-008.md,1460,ba73646930736570e3c766276779ac9f1b6adb2b47b765dba44bd481d301084a
CDS-009,Constitution and Governance,Controlled Source Hierarchy,"The configured tenant-specific source hierarchy shall determine precedence among client SOPs, safety agreements, product master data, applicable regulatory guidance, ClinixAI-controlled knowledge, dictionaries and AI reasoning. Conflicts shall be surfaced rather than silently resolved.",AI Constitution / Governance,Draft – Requires Approval,False,"ClinixAI Governance Standard; alignment to applicable GxP, data integrity, privacy and AI governance requirements",CDS-001,00_Governance/CDS-009.md,1469,195d83a1b3685934eb2c1c6527f304dde5ce7206fadb5c18a05471a77a4ddc2d
CDS-010,Constitution and Governance,Immutable Audit Principle,"Every material AI-assisted decision shall preserve the input evidence, retrieved knowledge identifiers and versions, model and prompt configuration, output, confidence, reviewer action, override reason and timestamp in an immutable audit record.",AI Constitution / Governance,Draft – Requires Approval,False,"ClinixAI Governance Standard; alignment to applicable GxP, data integrity, privacy and AI governance requirements",CDS-001,00_Governance/CDS-010.md,1499,b8379cf97b6d6f4d72a772be2b2d1a2bea4f0b543034f23eced5e4f034d19fd7
CDS-011,Constitution and Governance,Knowledge Versioning,"Every Knowledge Object shall have a stable identifier, semantic version, lifecycle status, owner, effective date, approval record, source traceability and revision history. Production retrieval shall use only the effective approved version for the tenant and workflow.",AI Constitution / Governance,Draft – Requires Approval,False,"ClinixAI Governance Standard; alignment to applicable GxP, data integrity, privacy and AI governance requirements",CDS-001,00_Governance/CDS-011.md,1501,1636a31e5b15deb77e0fe995d8c1ff79cc78f86c0a6cfa339160d82d15ec0ed2
CDS-012,Constitution and Governance,Knowledge Approval Workflow,"Knowledge shall progress through Draft, SME Review, Quality Review, Approval, Effective, Superseded and Retired states. Only approved and effective knowledge may drive production pharmacovigilance decisions.",AI Constitution / Governance,Draft – Requires Approval,False,"ClinixAI Governance Standard; alignment to applicable GxP, data integrity, privacy and AI governance requirements",CDS-001,00_Governance/CDS-012.md,1490,0334d7ddd9bafb3054517c0a4a5568589e731228c6149bef9144dc70341c1516
CDS-013,Constitution and Governance,Knowledge Retrieval First,AI workflows shall retrieve applicable governed knowledge and structured context before producing a regulatory interpretation. Retrieval failure or insufficient relevant knowledge shall trigger controlled uncertainty handling.,AI Constitution / Governance,Draft – Requires Approval,False,"ClinixAI Governance Standard; alignment to applicable GxP, data integrity, privacy and AI governance requirements",CDS-001,00_Governance/CDS-013.md,1460,a0912a94f5e6e593bafc7ea0d09f3e4614c78fe347337425b52d2357459967ad
CDS-014,Constitution and Governance,Tenant Isolation,"Client knowledge, product data, cases, search profiles, evidence and configurations shall remain isolated by tenant. Cross-tenant retrieval, indexing, caching or prompt assembly is prohibited.",AI Constitution / Governance,Draft – Requires Approval,False,"ClinixAI Governance Standard; alignment to applicable GxP, data integrity, privacy and AI governance requirements",CDS-001,00_Governance/CDS-014.md,1454,55e36c06667924249f8b0bbc86bfe1be842b483aa02a905e0c8972004e932077
CDS-015,Constitution and Governance,Least Assumption Principle,"ClinixAI shall minimize assumptions. When multiple interpretations remain plausible, the system shall present the supported alternatives, identify the unresolved evidence and escalate rather than select an unsupported conclusion.",AI Constitution / Governance,Draft – Requires Approval,False,"ClinixAI Governance Standard; alignment to applicable GxP, data integrity, privacy and AI governance requirements",CDS-001,00_Governance/CDS-015.md,1462,311b14eac0704f2b6e8c4cc4a5fb4d9aa262bd6d6894e5906c214c262b5ff1a2
CDS-016,Constitution and Governance,Medical Neutrality,"ClinixAI may identify and structure reported medical evidence but shall not diagnose a patient, invent a causal relationship or replace qualified medical assessment. Medical interpretation shall remain bounded by the source and approved references.",AI Constitution / Governance,Draft – Requires Approval,False,"ClinixAI Governance Standard; alignment to applicable GxP, data integrity, privacy and AI governance requirements",CDS-001,00_Governance/CDS-016.md,1464,dc0624fa13da5c6233748b301e15448add5e1a934d1dbf5ad76dc73b9a2bcee1
CDS-017,Constitution and Governance,Continuous Knowledge Governance,"Knowledge changes shall be proposed, reviewed, impact-assessed, approved, versioned, tested, deployed and monitored through a controlled process. Silent edits to production knowledge are prohibited.",AI Constitution / Governance,Draft – Requires Approval,False,"ClinixAI Governance Standard; alignment to applicable GxP, data integrity, privacy and AI governance requirements",CDS-001,00_Governance/CDS-017.md,1458,0dc3314530c9a0fbbafc315c2bd7cfeb0547123fd0569c9921ce674dfefa3069
